question,answer
"Chào bác sĩ, tôi muốn bác sĩ tư vấn giúp tôi. Tôi bị gãy xương đùi được 7 tháng nay. Cách đây 2 tháng chỗ xương gãy có dịch mủ, tôi đã được điều trị bằng kháng sinh đồ rồi. Một tháng lại đây chỗ gãy đó lại sưng tấy lên và có mủ, cứ mỗi lần rạch và nạo hết mủ bên trong được 1 thời gian nó lại tái phát. Bác sĩ tư vấn giúp tôi nên làm thế nào ạ?","Chào bạn, Với câu hỏi “Sưng tấy, chảy mủ vết mổ phải điều trị thế nào?"", bác sĩ xin giải đáp như sau: Về trường hợp của bạn, có thể tạm nghĩ tới chẩn đoán nhiễm khuẩn/ viêm xương - tủy xương mạn tính. Đây là một bệnh lý dai dẳng, điều trị khó dứt điểm và để lại nhiều biến chứng nặng cho bệnh nhân (không liền xương, đau đớn, nhiễm khuẩn máu). Với tính chất nghiêm trọng của bệnh, bạn nên thu xếp tới các cơ sở chuyên khoa Chấn thương chỉnh hình để được khám trực tiếp và tư vấn về biện pháp điều trị. Thông thường, để điều trị triệt căn sẽ mở rộng vết mổ cũ của bạn, tháo bỏ đinh hoặc nẹp vít (nếu có), cắt lọc tổ chức hoại tử, lấy bỏ xương chết, mở thông lòng ống tủy xương đùi và bơm rửa bằng hệ thống máy bơm tự động. Sau đó, vị trí nhiễm trùng sẽ phải đặt 1 loại hợp chất pha kháng sinh để cố định tạm ổ khuyết xương trong vòng ít nhất 6 tuần, kết hợp sử dụng kháng sinh tiêm. Sau đó, đánh giá lại, nếu tình trạng nhiễm khuẩn đã ổn định sẽ tháo bỏ xi măng và ghép xương cho bạn. Như vậy, bạn có thể thấy, điều trị nhiễm khuẩn xương là một phẫu thuật cực kỳ khó, phức tạp và cần sự kiên trì theo sát của bệnh nhân. Nếu bạn còn thắc mắc về việc sưng tấy, chảy mủ vết mổ, bạn có thể đến bệnh viện để kiểm tra và tư vấn thêm. Cảm ơn bạn đã đặt câu hỏi cho DICA. Chúc bạn có thật nhiều sức khỏe. Trân trọng!"
"Chào bác sĩ, cần chuẩn bị gì trước khi gây mê ở người bệnh tiểu đường? Mong bác sĩ giải đáp, em cảm ơn bác sĩ.","Chào bạn, Với câu hỏi “Cần chuẩn bị gì trước khi gây mê ở người bệnh tiểu đường?”, bác sĩ xin giải đáp như sau: Ngày nay, gây mê hồi sức cho người bệnh tiểu đường là vấn đề thường gặp. Để đảm bảo tốt cho cuộc phẫu thuật, người gây mê hồi sức cần phải có kiến thức về bệnh tiểu đường, các giai đoạn của bệnh, bệnh được điều trị hay không được điều trị, đã có biến chứng đến các cơ quan nào chưa. Nên trước khi gây mê cho người bị bệnh tiểu đường cần: - Đo đường huyết trước khi tiến hành tạo mê hồi sức - Kiểm tra kết quả sinh hóa máu - Đưa người bệnh tiểu đường đến phòng mổ sớm hơn 30 phút để các bệnh lý khác được phát hiện và sửa trước khi tiến hành mổ Do vậy các nguy cơ khi gây mê ở người tiểu đường có thể là nơi đến của cơ quan đích: Nếu bạn còn thắc mắc về gây mê ở người bệnh tiểu đường, bạn có thể đến bệnh viện để kiểm tra và tư vấn thêm. Cảm ơn bạn đã đặt câu hỏi cho DICA. Chúc bạn có thật nhiều sức khỏe. Trân trọng!"
Chào bác sĩ! Xin hỏi hiện nay có những phương pháp bảo tồn sinh sản cho phụ nữ nào đang áp dụng? Cảm ơn bác sĩ đã tư vấn.,"Chào bạn. Cảm ơn bạn đã đặt câu hỏi cho DICA. Hiện nay đang có những phương pháp bảo tồn sinh sản cho phụ nữ như: Nếu có ý định lựa chọn phương pháp bảo tồn sinh sản, bạn nên đến những bệnh viện lớn, có điều kiện cơ sở vật chất tốt như bệnh viện để được thực hiện một cách tốt nhất. Trân trọng."
"Bệnh viện Nhi Đồng 1 ghi nhận gần đây nhiều trẻ đột ngột bị giật mắt, miệng, lắc cổ, gật đầu vô thức, chẩn đoán mắc hội chứng Tic do xem nhiều tivi, điện thoại.","Bác sĩ , Khoa Nhiễm - Thần kinh, Bệnh viện Nhi Đồng 1, cho biết trước đây viện chỉ tiếp nhận 1-2 trường hợp, nay trung bình mỗi ngày khám và điều trị 5-6 trẻ mắc hội chứng Tic. Hội chứng Tic là các cử động hoặc phát âm xuất hiện bất thường, lặp đi lặp lại mất kiểm soát. Tần suất, cường độ và thời gian giật các cơ ở từng trẻ khác nhau, thường xảy ra ở trẻ dưới 18 tuổi, trầm trọng ở tuổi 11-12. Các triệu chứng xảy ra ở cơ vận động được gọi là Tic vận động, xảy ra ở cơ hô hấp thì gọi là Tic âm thanh. Biểu hiện bệnh là nháy mắt, hóp mũi..., một số cháu triệu chứng là thở dài, lẩm bẩm, tặc lưỡi, hắng giọng, la hét, nhún vai, lắc đầu, giật cơ hàm. Trẻ bệnh nặng sẽ nhại động tác của người khác, vuốt tóc, đá chân, nhảy, hoặc nói các từ, câu lặp và không phù hợp bối cảnh. Như chị (ở quận 10), sáng 18/11 đưa con ra khỏi phòng khám Nhiễm - Thần kinh, gương mặt buồn, mồ hôi đổ thành dòng khiến mái tóc chị bết lại. Cầm khăn lau mặt, người mẹ như nghẹn, cho biết bác sĩ chẩn đoán con trai 8 tuổi của chị mắc hội chứng Tic. Trước đó một tuần, bé đang bình thường bỗng xuất hiện các biểu hiện lạ như liên tục giật mắt, gật đầu, thỉnh thoảng lẩm bẩm một mình. Ban đầu chị nghĩ chỉ là hành động thoáng qua của trẻ nhỏ, nhưng các biểu hiện ngày càng dày đặc, chị nghỉ làm đưa con đi khám ""cho ra bệnh"". ""Bác sĩ nói con tôi bị như vầy là do xem tivi và điện thoại nhiều quá, cần phải hạn chế"", chị nói. Tương tự, anh Hà (ngụ Đồng Nai) đưa con gái 9 tuổi đến viện khám với các triệu chứng như nháy mắt, la hét, lắc đầu. Người cha kể thời gian Covid, con phải học online tại nhà nên đã quen với việc sử dụng các thiết bị điện tử. Đến nay, gia đình anh vẫn duy trì cho con học các môn khoa học và năng khiếu khác trên mạng nên không quản lý giờ giấc. Gần đây, anh Hà phát hiện con mình bắt đầu cuốn theo các trào lưu trên TikTok, cứ đi học về là ôm điện thoại xem. Hai tuần nay, bé bị giật mắt, la hét liên tục. ""Cô giáo nói con ở trường cũng có các biểu hiện lạ như vậy nên tôi đưa đi khám, bác sĩ nói con mắc hội chứng Tic rồi"", người đàn ông chia sẻ. Anh Hà, chị là hai trong nhiều phụ huynh đưa con đến khám tại phòng khám thần kinh Bệnh viện Nhi đồng 1 với các biểu hiện tương tự. Khi trẻ mắc các dấu hiệu trên, phụ huynh lo lắng bị viêm não hoặc co giật nên đưa đi khám. Tuy nhiên, bác sĩ Khánh nhấn mạnh trẻ mắc hội chứng Tic không bị ảnh hưởng tri giác, ý thức vẫn tỉnh táo bình thường. Nguyên nhân số trẻ mắc hội chứng này gần đây gia tăng có thể do thời gian giãn cách xã hội, trẻ ở nhà và tiếp xúc màn hình máy tính, điện thoại, tivi quá nhiều. Bệnh có thể điều trị, các rối loạn sẽ biến mất khi trẻ lớn, song rất dễ tái phát. ""Hướng điều trị thường được khuyến cáo nhất là dùng mẹo. Khi trẻ bị giật, cần đánh lạc hướng sự chú ý, cho trẻ đếm số, chạy bộ, nhảy dây để bộ não không tập trung vào các cơ đang bị giật nữa"", bác sĩ Khánh nói. Những trường hợp mắc hội chứng Tic nên vào viện để được bác sĩ kiểm tra chuyên sâu hơn. Trẻ thường tằng hắng, la hét ở lớp học ảnh hưởng đến môi trường học tập thì sẽ được kê thuốc. Trường hợp trẻ không đáp ứng thuốc hoặc không đủ liều lượng khiến bệnh trầm trọng hơn, cần nhập viện điều trị. Chuyên gia tâm lý Nhan Cẩm Nghi, Đơn vị Tâm lý, Bệnh Viện Nhi Đồng Thành phố, khuyến cáo sự thấu hiểu và đồng hành của cha mẹ góp phần quan trọng trong việc hỗ trợ trẻ ứng phó với hội chứng này. Theo đó, gia đình không nên phê phán trẻ và đảm bảo sự hỗ trợ, trấn an cần thiết. Phụ huynh cũng không căng thẳng, stress vì các biểu hiện lạ của con, bởi sự tức tối của người lớn có thể lây nhiễm sang con trẻ khiến bệnh nặng hơn. Ngoài ra, bố mẹ dành thời gian tương tác, giao tiếp với trẻ, hạn chế tiếp xúc thiết bị điện tử, tăng cường vận động..., sẽ giảm thiểu ảnh hưởng tiêu cực. ""Sự thông cảm, kiên nhẫn của gia đình đóng vai trò quan trọng trong việc trấn an và giúp trẻ gia tăng nhận thức về giá trị bản thân, đặc biệt trong giai đoạn thử thách này"", bà Nghi khuyên."
"Chào bác sĩ, bác sĩ cho em hỏi trong miệng mọc mụn như mụn nước nhưng không cảm thấy đau, cạy ra bên trong có nước nhờn là bị làm sao ạ? Cảm ơn bác sĩ.","Chào bạn, Trong miệng có nhiều tổ chức khác nhau như lợi dính, lợi di động, lưỡi, vòm miệng, tuyến nước bọt,.. Bạn nên đi khám khuyên khoa Răng - Hàm - Mặt ngay để được chẩn đoán ra bệnh và có hướng chữa trị kịp thời. Cảm ơn bạn đã đặt câu hỏi cho DICA."
"Chào bác sĩ, Em hay bị viêm mũi dị ứng, chảy nước mũi, hắt hơi. Bác sĩ cho em hỏi viêm mũi dị ứng kèm chảy nước mũi điều trị thế nào? Em có thể xài máy xông mũi để xông nước muối sinh lý được không? Em cảm ơn bác sĩ.","Chào bạn, Với câu hỏi “Viêm mũi dị ứng kèm chảy nước mũi điều trị thế nào?”, bác sĩ xin giải đáp như sau: Về điều trị viêm mũi dị ứng, hiện tại chưa ghi nhận phương pháp xông mũi với nước muối sinh lý như một liệu pháp điều trị. Thay vào đó, bạn có thể dùng nước muối sinh lý dưới định dạng bình xịt mũi hoặc dụng cụ bơm rửa mũi để vệ sinh hằng ngày. Nếu tình trạng vẫn không cải thiện, bạn nên khám với bác sĩ chuyên khoa để có đánh giá và lựa chọn điều trị thích hợp. Nếu bạn còn thắc mắc về viêm mũi dị ứng kèm chảy nước mũi, bạn có thể đến bệnh viện để kiểm tra và tư vấn thêm. Cảm ơn bạn đã đặt câu hỏi cho DICA. Chúc bạn có thật nhiều sức khỏe. Trân trọng!"
"Chào bác sĩ, Em bị đờm nhiều, khó thở, đau tức ngực khi thở đi khám chụp X-quang bác sĩ kết luận giãn phế quản, hiện bệnh của em kéo dài một năm rồi. Bình thường chỉ là đờm trong, nhưng khi làm việc mệt thì cơn co thắt, khó thở và tức ngực lại nặng hơn. Vậy bác sĩ cho em hỏi bệnh giãn phế quản cần điều trị như thế nào? Em cảm ơn bác sĩ.","Chào bạn, Với câu hỏi “Bệnh giãn phế quản cần điều trị như thế nào?”, bác sĩ xin giải đáp như sau: Giãn phế quản là tình trạng giãn khiến phế quản ở người bệnh rộng hơn bình thường, tạo điều kiện cho vi khuẩn tích tụ gây nhiễm trùng và các bệnh lý hô hấp khác. Triệu chứng của giãn phế quản ở người lớn chính là các ảnh hưởng hô hấp mà nó gây ra, thường gặp nhất là ho, ho ra đờm, hụt hơi, khó thở. Khi bệnh tiến triển nặng hơn, bệnh nhân có thể gặp những biến chứng nguy hiểm như: đau ngực, ngừng thở, ho ra máu, viêm xoang,... Các triệu chứng toàn thân gặp phải do viêm đường hô hấp như: cơ thể mệt mỏi, chán ăn, gầy sút, tinh thần giảm sút,... Với bệnh giãn phế quản, hiện chưa có biện pháp điều trị triệt để, việc điều trị hiện tại chỉ nhằm mục tiêu giảm tiến triển và triệu chứng bệnh, bao gồm: Để đạt được những mục tiêu điều trị này, bạn cần chẩn đoán và điều trị với bác sĩ chuyên khoa. Nếu bạn còn thắc mắc về giãn phế quản, bạn có thể đến bệnh viện để kiểm tra và tư vấn thêm. Cảm ơn bạn đã đặt câu hỏi cho DICA. Chúc bạn có thật nhiều sức khỏe. Trân trọng!"
"Chào bác sĩ, Mấy ngày nay em có hiện tượng bị tiểu rắt, tiểu nhiều lần trong ngày và tiểu xong vẫn có cảm giác buồn đi tiểu. Nước tiểu đục và thỉnh thoảng có chút máu. Sau khi đọc báo thì em nghĩ nguyên nhân là do không vệ sinh sạch sẽ sau khi quan hệ tình dục. Bác sĩ cho em hỏi: Tiểu nhiều lần, nước tiểu đục và có máu là dấu hiệu của bệnh gì, có thể điều trị tại nhà không ạ?","Chào bạn, Với câu hỏi “Tiểu nhiều lần, nước tiểu đục và có máu là dấu hiệu của bệnh gì?”, bác sĩ xin giải đáp như sau: theo thông tin bạn cung cấp thì nhiều khả năng bạn bị nhiễm khuẩn tiết niệu. Nhiễm khuẩn tiết niệu là tình trạng có sự xâm nhập của vi khuẩn vào hệ thống đường tiết niệu bao gồm thận, niệu quản, bàng quang và niệu đạo. Bạn phải đến bệnh viện để được khám và xét nghiệm, siêu âm để chẩn đoán xác định, tìm nguyên nhân và tư vấn hướng điều trị cụ thể bạn nhé. Ngoài ra, sau khi khám xong thì bạn có thể điều trị ngoại trú ở nhà. Nếu bạn còn thắc mắc về tiểu nhiều lần, nước tiểu đục và thỉnh thoảng có máu, bạn có thể đến bệnh viện để kiểm tra và tư vấn thêm bạn nhé. Cảm ơn bạn đã đặt câu hỏi cho DICA. Chúc bạn có thật nhiều sức khỏe. Trân trọng!"
"Sinh non là một trong những thách thức lớn của y khoa, nguyên nhân hàng đầu gây tăng bệnh lý trẻ sơ sinh và trẻ nhỏ nhưng có thể phòng ngừa.","Tỷ lệ tử vong ở trẻ liên quan sinh non cao gấp ba lần thai kỳ đủ tháng, giáo sư Gian Carlo Di Renzo, Liên đoàn Sản Phụ khoa quốc tế (FIGO), nói tại hội nghị sản phụ khoa Việt - Pháp, châu Á - Thái Bình Dương do Bệnh viện Từ Dũ tổ chức, ngày 13-14/10. Tổ chức Y tế Thế giới định nghĩa sinh non là chuyển dạ sinh trước 37 tuần tuổi thai. Đây là nguyên nhân hàng đầu làm tăng nguy cơ các bệnh như bất thường phát triển trí tuệ, bại não, động kinh, mù, điếc, loạn sản phế nang phổi, bệnh lý võng mạc trẻ non tháng... Trẻ sinh non có hệ miễn dịch yếu làm tăng khả năng nhiễm trùng huyết, viêm phổi, dễ rối loạn thân nhiệt, rối loạn tiêu hóa, viêm ruột hoại tử... Chức năng phổi chưa trưởng thành nên trẻ dễ bị suy hô hấp sau sinh và tử vong. Cơ chế gây sinh non hiện chưa được biết rõ, có thể liên quan đến nhau bong non, căng giãn tử cung quá mức hoặc hở cổ tử cung, các thay đổi về nội tiết xuất phát từ stress của mẹ hoặc thai nhi. Ngoài ra, tình trạng viêm nhiễm tại cổ tử cung, âm đạo cũng liên quan đến chuyển dạ sinh non. ""Rất khó để dự báo sinh non"", giáo sư phân tích. Các phương tiện nhằm xác định các thai phụ có nguy cơ sinh non chỉ đánh giá được nguy cơ trong thời gian ngắn, thường 48 giờ đến 7-14 ngày. Sàng lọc sinh non chủ yếu thực hiện qua việc đánh giá tiền căn thai sản và đo chiều dài cổ tử cung, hoặc định lượng fibronectin thai (một loại protein được sản xuất trong thai kỳ)... Thai phụ dự phòng sinh non bằng cách thay đổi hành vi và lối sống, bao gồm chế độ ăn và tập thể dục, bổ sung vi chất bao gồm calcium và kẽm, sàng lọc viêm nhiễm sinh dục, không hút thuốc uống rượu, giảm các hoạt động nặng... Bác sĩ sẽ cân nhắc dự phòng aspirin liều thấp cho thai phụ có nguy cơ tiền sản giật, điều trị viêm âm đạo bởi vi khuẩn, nấm. Thai phụ có tiền căn sinh non hoặc chiều dài tử cung ngắn, cường giáp, viêm nha chu thai kỳ... có những phác đồ điều trị riêng. Bổ sung calcium cho thai phụ nguy cơ rối loạn huyết áp. Theo bác sĩ Lê Võ Minh Hương, Bệnh viện Từ Dũ, thai phụ khám thai định kỳ để bác sĩ đánh giá các yếu tố nguy cơ sinh non, từ đó áp dụng biện pháp dự phòng thích hợp."
"Hà NộiThoa, 21 tuổi, sau khi sinh con thường xuyên buồn bã, khóc, bi quan, chán nản, không quan tâm tới việc chăm sóc con, thậm chí muốn tự sát.","Thoa dừng học khi đang là sinh viên năm ba, để sinh con. Sau sinh hai tuần, cô cảm thấy mệt mỏi, ít nói chuyện với mọi người, ăn uống không ngon miệng, hay ngồi một mình buồn bã và khóc, suy nghĩ bi quan. Mỗi ngày cô chỉ ngủ 3-4 tiếng, thường thức giấc giữa đêm, sáng dậy sớm. Thoa cũng không để tâm tới việc chăm sóc hay thể hiện tình cảm với con, cảm giác khó chịu khi nghe tiếng con khóc. Một lần cô dùng dao quyên sinh, người nhà đưa vào Bệnh viện Cu Ba Quảng Bình sơ cứu rồi chuyển tới khoa Tâm thần theo dõi. Sau 20 ngày điều trị, triệu chứng bệnh thuyên giảm, Thoa được về nhà song lại bắt đầu la hét, cáu gắt, chống đối không chịu uống thuốc. Sợ tình trạng kéo dài ảnh hưởng đến sức khỏe, gia đình đưa Thoa đến Viện sức khỏe Tâm thần, Bệnh viện Bạch Mai, bác sĩ chẩn đoán bị trầm cảm nặng sau sinh. Cũng rơi vào tình trạng trầm cảm sau khi sinh con gái, chị Ngân 35 tuổi luôn căng thẳng vì mẹ chồng có tư tưởng ""trọng nam khinh nữ"", không thích cháu gái, thậm chí không để cho chồng chị bế con. Sau sinh ba tháng chị mất ngủ, stress vì vừa chăm con, vừa làm việc nhà mà không nhận được sự chia sẻ từ chồng. Áp lực khiến chị u uất, hay suy nghĩ tiêu cực. Trả lời VnExpress ngày 8/7, Tiến sĩ Vũ Thy Cầm - Trưởng Phòng Tâm lý lâm sàng, Viện Sức khỏe Tâm thần, Bệnh viện Bạch Mai cho biết hai trường hợp trên đây đều rối loạn hành vi và tâm thần nặng do trầm cảm sau sinh, khiến bệnh nhân không kiểm soát hành vi, có người xuất hiện ảo thanh như nghe thấy tiếng nói trong đầu dẫn đến tự làm hại chính mình. Hai bệnh nhân may mắn được phát hiện, điều trị theo phác đồ kết hợp gia đình chăm sóc nên sức khỏe dần ổn định. Tuy nhiên, khoảng 50% phụ nữ bị trầm cảm sau sinh không được chẩn đoán bởi chuyên gia y tế, nhiều trường hợp biểu hiện nhẹ hoặc không chia sẻ, cố tình giấu bệnh, khi phát hiện thì đã ở giai đoạn nặng. Tổ chức Y tế Thế giới (WHO) ước tính khoảng 340 triệu người trên thế giới mắc trầm cảm và ít nhất 15% dân số có biểu hiện trầm cảm rõ rệt ở một giai đoạn nào đó trong cuộc sống, đặc biệt là sau sinh. Theo nghiên cứu của Ramadas (năm 2015), tỷ lệ trầm cảm ở phụ nữ sau sinh từ 10 đến 20% trên toàn thế giới. Trầm cảm bắt đầu ngay sau khi sinh con và kéo dài đến một năm. Tỷ lệ trầm cảm cao gấp ba lần trong 5 tuần đầu sau sinh và cao nhất ở 12 tuần đầu sau sinh; tỷ lệ tái phát 25-68%. Tại châu Á, tỷ lệ trầm cảm sau sinh dao động từ 3,5% đến hơn 63%. Trong đó, Pakistan có tỷ lệ trầm cảm sau sinh cao nhất và Malaysia tỷ lệ thấp nhất. Ở Việt Nam, nghiên cứu tại một số bệnh viện phụ sản, tỷ lệ trầm cảm sau sinh từ 11% đến 33% và thường khởi phát trong vòng 4 tuần đầu sau sinh. Riêng Bệnh viện B"
"Chào bác sĩ, Em bị rụng tóc hói đầu trên đỉnh và giờ lan ra phía sau. Em đã dùng nhiều loại thuốc trị rụng tóc, kích thích mọc tóc nhưng không có tác dụng. Vậy bác sĩ cho em hỏi rụng tóc hói trên đỉnh đầu khắc phục thế nào? Em cảm ơn bác sĩ.","Chào bạn, Với câu hỏi “Rụng tóc hói trên đỉnh đầu khắc phục thế nào?”, bác sĩ xin giải đáp như sau: Rụng tóc hói đầu thường do nguyên nhân: Di truyền. Tình trạng này cần điều trị lâu dài, mục đích là làm chậm quá trình rụng tóc và thay thế phần tóc bị rụng. Các loại thuốc thoa hay uống hiện nay đều chưa có hiệu quả cao đối với tình trạng hói đầu. Hiện tại có các phương pháp cải thiện tình trạng hói đầu khá hiệu quả như: PRP, tế bào gốc nang tóc, liệu pháp ánh sáng, cấy tóc. Bạn có thể đến các cơ sở uy tín để được tư vấn và chọn lựa phương pháp phù hợp nhất cho mình. Tuy nhiên, các phương pháp nói trên không ngăn cản được quá trình rụng tóc, vì vậy việc cải thiện lối sống, sinh hoạt và dinh dưỡng rất quan trọng trong việc làm chậm quá trình rụng tóc. Chế độ sinh hoạt, ăn uống: cải thiện tình trạng stress, nghỉ ngơi hợp lý, không thức khuya, không dùng các chất kích thích (rượu, bia, caffeine), ăn uống đầy đủ vitamin và khoáng chất. Ngoài ra, khi chăm sóc tóc cần chú ý: Chọn dầu gội phù hợp với da đầu, gội đầu nhẹ nhàng không dùng móng tay cào gãi da đầu, không thoa dầu xả trực tiếp lên da đầu, không chà xát tóc ngay sau khi gội đầu mà chỉ dùng khăn thấm khô nhẹ nhàng, không sấy tóc quá nóng, tốt nhất dùng chế độ gió của máy sấy, đưa máy sấy cách xa tóc ít nhất 20cm, sử dụng lược răng thưa chải đầu, không chải đầu khi tóc còn ướt. Cảm ơn bạn đã đặt câu hỏi cho DICA. Chúc bạn có thật nhiều sức khỏe. Trân trọng!"
