question,answer
"Chào bác sĩ! Hiện nay trên thị trường có cả những loại vitamin D3 kết hợp K2, ví dụ như sản phẩm D3 K2/MK7 của hãng Sunday Natural Đức với thành phần trong 1 giọt tương đương gồm D3- 200IE và K2- 15ug đấy ạ. Theo em được biết thì D3 vận chuyển canxi vào máu và K2 vận chuyển canxi từ máu vào xương đúng không ạ? Vậy cho em hỏi bé nhà em sơ sinh 3 ngày tuổi thì có nên chọn loại vitamin D3 kết hợp K2 nêu trên không ạ? Và liều lượng cho bé dùng 1 ngày bao nhiêu giọt thì đủ tiêu chuẩn ạ? Mặt khác, trên thị trường cũng có sản phẩm D3 kết hợp men vi sinh Bigaia Semper Thuỵ điển, mỗi ngày dùng cho bé 5 giọt. Em có nên chọn loại vitamin D3 kết hợp như vậy không? Và men vi sinh dùng cho bé sơ sinh trong trường hợp nào ạ? Men Vi sinh Biogaia Protectis Việt Nam khuyến cáo nên bổ sung dự phòng cho bé sơ sinh càng sớm càng tốt và liên tục thường xuyên hàng ngày trong 3 năm đầu đời của bé để tăng sức đề kháng và hệ miễn dịch hoàn thiện thì có đúng không ạ? Trong khi em tham khảo một số nước có sản phẩm Bigaia/ Biogaia thì họ chỉ khuyên dùng khi hệ tiêu hoá của trẻ có vấn đề? Xin bác sĩ tư vấn giúp em các thắc mắc trên. Em cảm ơn.","Chào bạn! Vitamin K2 theo các nghiên cứu cho thấy nó giúp định hướng canxi từ máu vào xương tốt hơn, chỉ có nghiên cứu trên người lớn và trẻ em. Ở trẻ sơ sinh trong tuần đầu thường có thiếu vitamin K do chức năng gan chưa hoàn thiện và lượng vitamin K qua nhau thai thấp, nên có nguy cơ chảy máu. Vì vậy trẻ sơ sinh được cho dùng Vitamin K1 là thường quy. Việc sử dụng Vitamin K2 chưa được khuyến cáo chính thức sử dụng ở trẻ sơ sinh, nên chỉ sử dụng khi có chỉ định của bác sĩ trong các trường hợp cụ thể. Trẻ sơ sinh đủ tháng có thể bổ sung vitamin D3 từ lúc 1 tháng tuổi. Trẻ sinh non bổ sung ngay khi ra đời. Liều dùng khuyến cáo 400 - 800 UI . Men vi sinh chỉ định dùng cho trẻ sơ sinh trong các trường hợp: Hiện nay chưa có khuyến cáo về việc dùng kéo dài liên tục thường xuyên trong 3 năm, theo WHO không khuyến cáo sử dụng men vi sinh cho mọi trẻ sơ sinh. Bạn có thể đến khám tại các cơ sở trên toàn quốc để được các bác sĩ giàu kinh nghiệm tư vấn và hướng dẫn. Trân trọng."
Chào bác sĩ. Em bị chấn thương cũng lâu rồi nhưng đợt này em thường xuyên bị nhức đầu. Em đã đi chụp X-quang sọ não thì phát hiện một bên não to một bên não nhỏ. Bác sĩ cho em hỏi em có bị làm sao không ạ? Sau này có di chứng gì không ạ? Mong bác sĩ tư vấn.,"Chào em. Theo em nói phim chụp của em một bên não to, một bên không, bác sĩ nghi ngờ giãn não thất. Em nên mang phim đến để bác sĩ tư vấn thêm em nhé! Cảm ơn em đã đặt câu hỏi tới DICA. Trân trọng."
Huyết trắng của tôi không phải màu trắng sữa mà là màu trong suốt như nước vậy có sao không ạ ? Ki (2008).,"Khi bước vào tuổi dậy thì, buồng trứng của bé gái bắt đầu phát triển, lượng nội tiết tố cũng tăng lên, hình thành khí hư hay còn gọi là huyết trắng sinh lý. Huyết trắng sinh lý không mùi, màu trắng trong, lúc rụng trứng thường có lượng nhiều, trước hành kinh lượng ít hơn, đặc và đục hơn, không gây ngứa ngáy khó chịu. Huyết trắng sinh lý bình thường thể hiện trạng thái sức khỏe sinh sản và phụ khoa của chị em khỏe mạnh. Nếu bị khí hư màu bất thường, có mùi hôi, kèm theo triệu chứng đau ngứa, khó chịu thì nên sớm đi khám bác sĩ chuyên khoa để được chẩn đoán và điều trị."
"Chào bác sĩ, Cách đây 10 năm tôi đi khám bị thận ứ nước, uống thuốc thì hết bệnh. Hiện nay, tôi có đau như lần trước nên tôi biết tôi bị tái phát bệnh. Tôi bị đau bụng dưới bên phải đau dữ dội khoảng 4- 5 tiếng, sau 1 thời gian hết đau. Bác sĩ cho tôi hỏi, đau bụng dưới bên phải dữ dội có phải do bệnh thận ứ nước tái phát không?","Chào bạn, Với câu hỏi “Đau bụng dưới bên phải dữ dội có phải do bệnh thận ứ nước tái phát không?”, bác sĩ xin giải đáp như sau: Bạn có tiền sử bệnh 10 năm, có cơn đau bụng dưới bên phải, có thận ứ nước, lần này cũng đau lại như cũ, có thể là cơn đau quặn thận tái phát. Bạn nên đi khám khi có cơn đau, nhất là có lần bị thận ứ nước và không nên uống thuốc giảm đau khi chưa xác định tình trạng đau bụng. Bác sĩ có thể cho bạn làm các xét nghiệm máu, nước tiểu, siêu âm, X Quang... để xác định nguyên nhân và có phương pháp điều trị thích hợp. Thông thường, cơn đau quặn thận do sỏi niệu quản, gây đau khi sỏi di chuyển , biến chứng có thể gây thận ứ nước, nhiễm trùng tiết niệu... nặng hơn gây suy thận. Khi đau vùng bụng dưới bên phải, bạn cần đi khám để bác sĩ loại trừ trường hợp viêm ruột thừa. Nếu bạn còn thắc mắc về thận ứ nước, bạn có thể đến bệnh viện để kiểm tra và tư vấn thêm bạn nhé. Cảm ơn bạn đã đặt câu hỏi cho DICA. Chúc bạn có thật nhiều sức khỏe. Trân trọng!"
"Ba tháng trước tôi mắc Covid-19, chu kỳ kinh nguyệt đang đều đặn bị thay đổi, hơn 40 ngày mới có một lần, đau bụng và mệt mỏi hơn. Tôi có cần đi điều trị không? ().","Ngày càng có nhiều phụ nữ báo cáo rằng Covid-19 đã ảnh hưởng đến chu kỳ kinh nguyệt của họ. Chu kỳ không đều và các vấn đề về kinh nguyệt có thể làm tăng mức độ nghiêm trọng của các triệu chứng hậu Covid và gây ảnh hưởng lâu dài đến hệ thống sinh sản của nữ giới. Rối loạn kinh nguyệt hậu Covid có các biểu hiện, như chu kỳ kinh nguyệt không đều: kéo dài, rong kinh - cường kinh hoặc vô kinh - thiểu kinh...; bất thường về tính chất máu kinh: có cục máu đông bất thường trong dịch tiết kinh nguyệt. Hội chứng tiền kinh nguyệt (PMS) tồi tệ hơn: dễ bị kích thích, lo lắng, kích động, tức giận, mất ngủ, khó tập trung, lơ mơ, trầm cảm, đau đầu, chóng mặt, bức bối của các chi, ngất, đánh trống ngực, táo bón, buồn nôn, nôn... và mệt mỏi nghiêm trọng hơn. Các nguyên nhân gây rối loạn kinh nguyệt hậu Covid-19 có thể là mất cân bằng nồng độ của các nội tiết tố sinh dục như estrogen và progesterone. Ngoài ra, nCoV gây rối loạn đông máu, làm ảnh hưởng đến kinh nguyệt. Những áp lực bên ngoài tác động trong và sau Covid-19 dẫn đến tâm lý lo lắng, căng thẳng; hoặc sử dụng thuốc điều trị các bệnh lý nền trước đó (tăng huyết áp, đái tháo đường...) cũng góp phần ảnh hưởng đến chu kỳ kinh nguyệt. Theo các nghiên cứu, kinh nguyệt có thể trở lại bình thường sau 1-2 chu kỳ. Tuy nhiên, nếu bạn có chu kỳ kinh nguyệt thay đổi kéo dài cần phải thăm khám để loại trừ các bệnh lý sản phụ khoa hay nguyên nhân khác, trước khi nghĩ đến do ảnh hưởng của nCoV. Các bệnh lý thường gặp gây rối loạn kinh nguyệt bao gồm bệnh lý tử cung (u xơ hay polyp), rối loạn cân bằng nội tiết tố nữ, lạc nội mạc tử cung, bệnh lý gây viêm nhiễm vùng chậu, hội chứng buồng trứng đa nang, ung thư tử cung hay cổ tử cung, một số bệnh lý khác như bệnh tuyến giáp, rối loạn chức năng tuyến yên... Để cải thiện rối loạn kinh nguyệt sau khỏi Covid, bạn cần điều chỉnh chế độ ăn uống, ngủ nghỉ đúng giờ, bổ sung các chất dinh dưỡng cần thiết; kết hợp rèn luyện thể dục thể thao thường xuyên, đặc biệt là các bài tập thư giãn (thiền, yoga...); giữ tâm lý thoải mái, suy nghĩ tích cực; hạn chế sử dụng rượu, bia, thuốc lá, và các chất kích thích khác. Trong y học cổ truyền, ngoài các bài thuốc điều trị theo từng thể bệnh còn có thể phối hợp với các phương pháp không dùng thuốc như châm cứu, nhĩ châm, cấy chỉ, xoa bóp, dưỡng sinh... giúp điều hòa kinh nguyệt an toàn, hiệu quả lâu dài."
"Chào bác sĩ, em xét nghiệm sắt chỉ số là 5,12 và chỉ số ferritin là 244. Mong bác sĩ tư vấn ý nghĩa kết quả xét nghiệm Ferritin, cảm ơn bác sĩ.","Chào bạn, Với câu hỏi “Tư vấn ý nghĩa kết quả xét nghiệm Ferritin”, bác sĩ giải đáp như sau: Ferritin là một dạng protein dự trữ sắt hoạt động trong các tế bào máu, chúng liên quan đến các tổ chức dự trữ sắt ở khắp cơ thể. Protein này có mặt tại gan, lá lách, tủy xương và một phần còn lại xuất hiện trong huyết thanh của máu. Trong các cơ chế chuyển hóa, sắt tham gia vào quá trình vận chuyển oxy, tổng hợp DNA, vận chuyển electron... Chỉ số bình thường sắt huyết thanh trong máu đối với nữ là: μmol/L. Trong trường hợp của bạn, chỉ số Ferritin trong giới hạn bình thường, chỉ số sắt huyết thanh giảm. Nguyên nhân giảm lượng sắt huyết thanh thường gặp là: Nếu bạn còn thắc mắc về việc xét nghiệm Ferritin, bạn có thể đến cơ sở y tế thăm khám và điều trị sớm. Cảm ơn bạn đã đặt câu hỏi cho DICA. Chúc bạn có thật nhiều sức khỏe. Trân trọng!"
"Chào bác sĩ, Em bị viêm họng cấp, thi thoảng có ho nhưng không đau ngực, khó thở. Em đi khám chụp X - quang thì kết quả hình ảnh đậm 2 bên rốn phổi, rãnh mờ liên thùy trái. Vậy bác sĩ cho em hỏi kết quả chụp X - quang đậm 2 bên rốn phổi là sao? Em cảm ơn bác sĩ.","Chào bạn, Với câu hỏi “Kết quả chụp X - quang đậm 2 bên rốn phổi là sao?”, bác sĩ xin giải đáp như sau: Bạn chụp X - quang có kết quả đậm hai rốn phổi, rãnh liên thùy trái như vậy gợi ý viêm phế quản phổi. Tuy nhiên để chẩn đoán xác định, bác sĩ phải thăm khám lâm sàng và dựa trên các xét nghiệm khác nữa (công thức máu, CRP, PCT...). Do đó, bạn cần đăng ký với bác sĩ chuyên khoa Hô hấp để được thăm khám và điều trị. Nếu bạn còn thắc mắc về kết quả chụp X - quang đậm 2 bên rốn phổi, bạn có thể đến bệnh viện để kiểm tra và tư vấn thêm. Cảm ơn bạn đã đặt câu hỏi cho DICA. Chúc bạn có thật nhiều sức khỏe. Trân trọng!"
"Chào bác sĩ, Em bị ngứa khoảng gần 2 tuần nay dạng như mề đay, ngứa nhiều vào buổi tối và ban đêm. Em bị ngứa nhiều vị trí khác nhau nốt tớ nốt nhỏ đều có cảm giác như gãi đến đâu ngứa đến đó từng đám. Có khi ngứa cả đêm có khi ngứa vài tiếng có khi vài phút tắm xong lúc là khỏi. Em có uống thuốc thấy đỡ nhưng dừng lại bị nhiều. Trong thời gian bị bệnh, em ăn uống sinh hoạt bình thường không dùng mỹ phẩm lạ, không ăn đồ lạ, không uống thuốc lạ. Bác sĩ cho em hỏi nổi mẩn ngứa kéo dài 2 tuần điều trị thế nào? Em cảm ơn.","Chào bạn, Với câu hỏi “Nổi mẩn ngứa kéo dài 2 tuần điều trị thế nào?”, bác sĩ xin giải đáp như sau: Theo như bạn mô tả, bác sĩ chẩn đoán bạn bị bệnh mày đay cấp tính. Nguyên nhân gây ra gây nên bệnh này có rất nhiều nguyên nhân, và việc xác định nguyên nhân cũng thường là rất khó khăn. Bạn cần đi khám bác sĩ chuyên khoa Da Liễu, để bác sĩ có chỉ định xét nghiệm tìm nguyên nhân và kê đơn thuốc điều trị cụ thể. Nếu bạn còn thắc mắc về nổi mẩn ngứa kéo dài 2 tuần, bạn có thể đến bệnh viện để kiểm tra và tư vấn thêm. Cảm ơn bạn đã đặt câu hỏi cho DICA. Chúc bạn có thật nhiều sức khỏe. Trân trọng!"
"Ngạt mũi, chảy nước mũi, ho, viêm họng, khó thở, sốt là những dấu hiệu sớm cảnh báo bệnh viêm hô hấp ở trẻ khi trời rét đậm.","Ngày 7/12, PGS. TS Phạm Thị Bích Đào, Bộ môn Tai Mũi Họng, Bệnh viện Đại học Y Hà Nội, cho biết khi giao mùa, sức đề kháng giảm, trẻ dễ bị ngạt tắc mũi, chảy nước mũi, viêm tai mũi họng. Đây là dấu hiệu đầu tiên cảnh báo khả năng các em bị nhiễm trùng hô hấp. Khi sức khỏe bình thường, trẻ thở bằng mũi chậm rãi, đều đặn, không có tiếng kêu và miệng ngậm. Trường hợp mũi bị tắc, trẻ thở khó khăn và có tiếng kêu. Trẻ phải thở bằng miệng nên họng khô, rát, chất nhầy của mũi chảy xuống họng khiến các em hay ho, trớ. Khi bị ngạt, trẻ có thể nói không rõ các phụ âm M, N (M đọc thành B và N đọc thành Đ). Ngạt tắc mũi cũng hay gây ra tắc vòi tai, khiến trẻ nghễng ngãng và ù tai, lúc nghe được lúc không. Tiếng thở của trẻ trở nên nặng, ban đêm ngáy to, thỉnh thoảng có những cơn ngạt thở và ho rũ do co thắt thanh quản. Ở trẻ sơ sinh, ngạt tắc mũi làm các em bú khó khăn, bú không được dài hơi, dễ bị sặc vì không thở được bằng miệng. Bố mẹ nên theo dõi tình trạng sức khỏe trẻ, phát hiện sớm triệu chứng, nhất là những ổ viêm nhiễm ở mũi họng, răng miệng. Nên hướng dẫn trẻ cách xì mũi để không đẩy mủ và vi trùng lên tai giữa hoặc vào xoang. Đeo khẩu trang mỗi khi ra đường, hạn chế tiếp xúc gió lạnh, ô nhiễm từ bụi, xăng, hóa chất. Hạn chế đưa trẻ đến những nơi đông người, vì dễ bị lây nhiễm khi cơ thể các em chưa đủ sức đề kháng. Lưu ý, hầu hết bệnh hô hấp, tai mũi họng ở trẻ đều do virus nên thường chỉ dùng các thuốc chữa triệu chứng như hạ sốt, giảm ho, long đờm, chống ngạt tắc mũi... để cơ thể các em có khả năng tự sản sinh ra kháng thể chống lại các bệnh lý này. Tuyệt đối không tự ý dùng kháng sinh hay tự kê đơn thuốc khiến cơ thể mất khả năng đề kháng, phụ thuộc vào thuốc, dễ bị nhiễm bệnh, nặng hơn là kháng thuốc. Ngoài ra, sử dụng kháng sinh liên tục sẽ làm tổn thương một số cơ quan còn non nớt của trẻ như gan, thận, tuỵ... Trường hợp trẻ dấu hiệu nặng lên như sốt cao liên tục không hạ, mệt mỏi, bứt rứt, khó chịu, đau đầu, buồn nôn, gia đình cần đưa đến bệnh viện. Trẻ cần được bổ sung thực phẩm giàu đạm từ thịt, cá, trứng, thịt gia cầm, ngũ cốc nguyên hạt, các sản phẩm từ sữa ít béo, cho ăn nhiều rau xanh và trái cây tươi giàu vitamin, đặc biệt là vitamin C từ nước cam, chanh, bưởi, dưa hấu. Nếu trẻ mệt, biếng ăn, nên chia nhỏ bữa ăn thành 5-6 lần trong ngày, giúp dễ ăn và hấp thu dinh dưỡng tốt hơn."
"Chào bác sĩ! Vợ em đang mang bầu lần đầu, thai nhi được 13 tuần tuổi có đi làm xét nghiệm Rubella thì kết quả: Thưa bác sĩ, mang thai 13 tuần, xét nghiệm Rubella IgM và IgG đều dương tính có sao không? Vợ em bị nhiễm mới hay là đã có kháng thể?","Chào bạn! Bạn cần nói rõ khoảng thời gian làm 2 lần xét nghiệm này bao lâu để bác sĩ có thông tin tư vấn cụ thể. Trường hợp của vợ mang thai 13 tuần, xét nghiệm Rubella IgM và IgG đều dương tính. Rubella IgM dương tính có nghĩa là đang nhiễm Rubella cấp tính hoặc mới nhiễm gần đây. Tuy nhiên, xét nghiệm Rubella IgM có thể xảy ra dương tính giả do phản ứng chéo với các bệnh nhiễm trùng khác hoặc do phản ứng với các protein khác của cơ thể. Hơn nữa xét nghiệm Rubella IgG dương tính 2 lần với nồng độ hầu như không thay đổi, nếu thời gian xét nghiệm này làm các nhau 2 tuần, có nghĩa là không có sự gia tăng hiệu giá kháng thể IgG, tương ứng không phải đang trong giai đoạn nhiễm cấp của bệnh trong vòng 12 tuần trở lại đây. Tuy nhiên, vợ bạn đang mang thai tuần thứ 13, nằm trong giai đoạn thai nhi có nguy cơ bị dị tật cao nếu nhiễm Rubella. Do đó, để khẳng định chắc chắn vợ và thai nhi có đang nhiễm Rubella giai đoạn cấp không, bạn cần làm thêm xét nghiệm Rubella PCR để khẳng định. Cảm ơn bạn đã đặt câu hỏi cho DICA. Trân trọng!"
"Lắng nghe cơ thể, thay đổi kế hoạch tập luyện, chuẩn bị quần áo, phụ kiện phù hợp là những quy tắc cơ bản giúp runner chạy hiệu quả khi trời nắng nóng và độ ẩm cao.","Chưa đầy 2 tuần nữa VnExpress Marathon Amazing Hạ Long 2022 sẽ chính thức khởi tranh. Runner cả nước đang tăng tốc tập luyện dưới thời tiết nắng nóng chuẩn bị cho giải. Chạy bộ dưới thời tiết mùa hè khiến nhiệt độ cơ thể tăng nhanh, khi đó mồ hôi tiết ra để làm mát, dẫn đến tình trạng mất nước. Theo nghiên cứu, lượng nước giảm đi 3 - 4%, hiệu quả luyện tập sẽ bị giảm sút từ 5 - 10%. Runner có thể lưu ý một số vấn đề sau để luyện tập an toàn và hiệu quả hơn trong mùa hè. Trang phục chống nắng Thời tiết nắng nóng thường khiến runner chán nản, tập luyện kém hiệu quả. Trang phục phù hợp cùng với sản phẩm kem chống nắng có chỉ số SPF (chỉ số chống nắng) cao sẽ giúp người chạy thoải mái hơn. Người chạy nên mặc trang phục có màu sáng, chất vải mỏng, nhẹ và có lỗ thông hơi. Chất liệu sợi bông hỗn hợp hoặc polyester sợi nhỏ sẽ thấm hút mồ hôi tốt hơn, tạo cảm giác thoải mái khi vận động. Bên cạnh đó, cần chuẩn bị thêm găng tay, mũ, kính râm và kem chống nắng có chỉ số SPF từ 30 trở lên để bảo vệ làn da trước tác hại của tia UV. Thời tiết Hạ Long tháng 7 được dự báo sẽ nóng và ẩm, vì thế các vận động viên tham gia VnExpress Marathon cần có sự chuẩn bị kỹ lưỡng về mặt trang phục. Ngoài quần, áo và giày chạy, runner cần thêm kính thể thao chuyên dụng để bảo vệ mắt, hạn chế tình trạng đau đầu do nheo mắt quá nhiều vì ánh mặt trời. Mũ đội đầu không chóp sẽ thoát nhiệt tốt, làm mát hiệu quả hơn các loại mũ kín. Trong quá trình chạy, bàn chân sẽ đổ rất nhiều mồ hôi vì vậy không nên sử dụng loại tất với thành phần 100% cotton, khiến chân bị ẩm và phồng rộp. Tất làm từ acrylic, CoolMax, Polyester thoát ẩm tốt hơn. Điều chỉnh kế hoạch luyện tập Không nên tập luyện quá lâu với cường độ và thời gian như những ngày trời mát mẻ. Linh hoạt điều chỉnh cung đường, thời gian chạy trong ngày là điều cần thiết. Runner nên chạy ở những cung đường có nhiều bãi cỏ, chạy ven hồ thay vì đường bê tông để không bị cái nóng hầm hập phả lên từ mặt đường khiến cơ thể khó chịu, mất sức. Thời điểm lý tưởng để luyện tập là vào sáng sớm, khi mặt trời chưa lên cao hoặc tối muộn khi tắt nắng. Từ 10h đến 15h là khoảng thời gian không nên tập luyện vì nắng gắt, cơ thể dễ bị mất nước, kiệt sức do nhiệt. Tuy nhiên cần hoàn thành bài tập trước khi đi ngủ một tiếng để tránh tình trạng khó ngủ. Runner cũng có thể cân nhắc giữa việc tập luyện ngoài trời với các động tác bổ trợ trong nhà những ngày nắng nóng. Trả lời phỏng vấn chuyên trang Runner's World, Richard A.Lovett - tác giả của nhiều cuốn sách về khoa học thể thao cho biết, nếu đã làm quen được với điều kiện thời tiết nắng nóng thì trước cuộc đua 2 ngày, mọi người nên nghỉ ngơi để cơ thể không bị quá căng thẳng. Lắng nghe cơ thể Runner không nên cố gắng tập luyện với cường độ cao dù việc này có thể làm chậm kế hoạch luyện tập. Có thể tham khảo nguyên tắc bắt đầu thật chậm để theo dõi phản ứng của cơ thể. Nếu cảm thấy cơ thể đáp ứng được điều kiện môi trường thì có thể dần dần tăng tốc. Hiệp hội Chạy bộ và Thể thao Mỹ khuyến cáo người chạy nên giảm 65 - 75% cường độ tập luyện khi bắt đầu trong điều kiện nắng nóng. Nhịp tim và nhiệt độ cơ thể là 2 chỉ số runners phải"
"Chào bác sĩ, em đang có bầu 4 tháng, bị ho cúm, bác sĩ kê cho thuốc *** 500mg uống có ảnh hưởng gì không ạ? *** (***).","Chào em, nếu em bị sốt do cúm thông thường thì không nên dùng kháng sinh em nhé. Nếu cúm có chỉ định dùng kháng sinh thì loại em đang uống là kháng sinh an toàn cho bầu em nhé."
"Chào bác sĩ, tôi gần 40 tuổi, da mặt hơi chảy xệ, có nếp nhăn. Tôi muốn làm căng da nhưng sợ đau và rất ngại động đến dao kéo. DICA có điều trị da chảy xệ có nếp nhăn không xâm lấn không? Cảm ơn bác sĩ tư vấn.","Chào bạn, Với câu hỏi “DICA có điều trị da chảy xệ có nếp nhăn không xâm lấn không?”, bác sĩ giải đáp như sau: Da chảy xệ là 1 biểu hiện của lão hóa da khi tổng diện tích da tăng lên, các sợi collagen và elastin trong chất nền của da giảm. Hiện nay có nhiều giải pháp khác nhau từ không xâm lấn, xâm lấn tối thiểu và can thiệp thủ thuật, phẫu thuật để giúp cải thiện tình trạng chảy xệ. Các ứng dụng công nghệ cao đang ngày càng tỏ ra tính ưu việt để giúp cải thiện tình trạng chảy xệ mà thậm chí hoàn toàn không đau và không sử dụng bất cứ biện pháp chống đau nào. Nếu bạn còn thắc mắc về việc DICA có điều trị da chảy xệ có nếp nhăn không xâm lấn không, bạn có thể đến cơ sở y tế thăm khám và điều trị sớm. Cảm ơn bạn đã đặt câu hỏi cho DICA. Chúc bạn có thật nhiều sức khỏe. Trân trọng!"
"Chào bác sĩ! Bé bị suy dinh dưỡng bào thai, khi sinh nặng 1kg4 kèm nhiễm trùng máu và nhiễm khuẩn dạ dày. Hiện tại bé 18 tháng tuổi, nặng 6kg và cao 63cm. Bé bị nóng trong, dễ táo bón, không hấp thụ được các loại sữa năng lượng cao, bé khó lên cân. Bác sĩ cho em hỏi, trẻ 18 tháng tuổi khó lên cân nên khám gì? Mong bác sĩ tư vấn giúp em. Em xin cảm ơn.","Chào bạn! Với câu hỏi “Trẻ 18 tháng tuổi khó lên cân nên khám gì?”, bác sĩ xin được trả lời như sau: Theo như mẹ mô tả, bé bị suy dinh dưỡng mẹ nhé. Mẹ cần đưa bé đến khám khoa dinh dưỡng để bác sĩ có thể đánh giá trực tiếp tình trạng bé một cách toàn diện từ đó bác sĩ mới có thể chẩn đoán và tư vấn điều trị cho bé được mẹ nhé. Cảm ơn bạn đã đặt câu hỏi cho DICA."
